id,lg_code,cat_code,cat_code_24,axis_no,pattern_no,pattern_name_ja,summary_ja,context_ja,b_problem_ja,problem_ja,b_solution_ja,solution_ja,consequence_ja,pattern_name_en,summary_en,context_en,b_problem_en,problem_en,b_solution_en,solution_en,consequence_en,learning_style_identifier
61,4,27,24,9,27,自分なりの強み,強みはかけ合わせると独自の個性になる。,企画をつくり価値を生み出す仕事に就いている。,自分がやっているからこその価値を出すことができなければ、他の人に頼んでも同じになってしまう。,一点だけで他の人を凌駕するほどの大きな強みをもっているのでない限り、他の人と同じような経験を積みながら、自分だけが圧倒的な強みを築き、独自の成長を遂げるというケースはあまりない。,自分の得意なことや特徴をかけ合わせたものが「自分の強み」だと捉え、それが今後どのようになればよいかを見極め、自分の強みを育てていく。,自分の得意なことや特徴だと思うものを《徹底リスト》として書き出し、《考えるための点数化》などをしながら、強みの要素を見つけていく。そして、それらの特徴をかけ合わせた「自分の強み」は周囲に勝てる武器になるか、マーケット的に需要があるかを見極めながら、新たな強みを足したり強化したりしていく。,自分なりの強みを認識した上で企画に取り組むことで、自分らしい仕事をすることができる。いくつかの強みをかけ合わせることで独自性をつくるため、多様なあり方があり、周囲と闘うことなくオリジナリティを出していくことが可能になる。仕事における自分らしさをつかみ、確立できれば、経験を積むことでそれをどんどん強化することができるので、安定した個性をもった企画人として生きていくことができる。,Combination of Strengths,Your combined strengths define your individuality.,Your job is to design projects that create new value.,"If you are not creating value that only you can create, then your clients may ask others to do the same job.","There are few cases in which someone with an average experience level is able to excel and outperform others, unless that person has exceptional strength in a certain area.","Define your “strength” as the combination of your abilities and characteristics, and think about how to develop them.","Conduct a “Thorough Listing” of all of your abilities and characteristics, and then identify those that are elements of your strength using “Interactive Scoring.” Determine whether your overall “strength” makes you stand out from your peers or whether there is a demand for it in the market. Then, add or reshape your strengths accordingly.","By recognizing your strengths, you will be able to put your best abilities to use in your work. You will also build your individuality by creating a unique combination of your strengths and differentiating yourself without competing with others. Once you have established a concrete image of your identity, experience will further strengthen your individuality.",3
62,4,19,19,9,28,目標にする三人,それぞれの良い面を取り入れると自分なりの成長がある。,もっと成長していきたいと思っている。,目指す未来像をぼんやりと描いているだけだと、なかなかそこにたどり着くことができない。,自分がどうなりたいのかを漠として捉えていると、それを現実にするためにどのような努力や経験をしたらよいかも明確にならない。そのため、達成することがなかなかできないし、成長していても目標に向けて正しい路線で進んでいるかどうかさえも、曖昧で判断できなくなってしまう。目指したい人が具体的に見つかっていたとしても、その人のようになりたいという漠然とした設定をしていると、いつまでたってもその人の成り損ないのような存在になってしまう恐れがある。,「◯◯の面ではこうなりたい」と思う人を三人見つけ、それぞれそうなれる方法を考え、実行する。,なりたい像を考える際には、「目指したい一人」ではなく、「参考にしたい三人」を見つける方がよい。1人のある部分は目指したいが、他の部分は自分とは合わないと思うと、そこを補填する要素をもった人を見つけて合わせていくことで、自分らしい未来像をつくっていくことができる。,自分の目指したい未来像を具体的にもつことで、どのような時間を過ごすべきかが明確になり、到達が容易になる。また、複数人の良いところを合わせていくと、誰かを真似した劣化コピーではなく、新しい自分らしさをつくることができる。自分の望む成長を上司や先輩に伝えておくと、適切なアドバイスを得やすく、経験から学ぶことがさらに増えていくだろう。,Three Role Models,Combine the positive traits of each person to create your own vision.,You want to continue growing in your career.,"If you only have a vague idea of how you would like to be in the future, then it will be difficult to get there. ","If your goals are vague, then you will not know what you need to do in order to achieve them. Hence, it becomes very difficult to achieve your goals, and to even know whether you are on the “right track.” Even if you have clear role models, just vaguely thinking that you want to be like them will not help you reach your goal. ","Find three role models with certain traits that you admire, think about how you can adapt these qualities, and take action.","When thinking about your desirable future, it is better to have three role models that inspire you rather than having one role model that you want to be exactly like. Create a unique vision of your future by combining different elements from various people.","By having a concrete vision of your future, you are able to think about and decide how to work toward your goal, which makes it more achievable. In addition, by combining different traits from several people, your vision is not just a copy of someone else, but is one that is unique to you. If you share these goals with your boss/superior, then you will receive more relevant advice and have more opportunities to learn from your experiences.",1
63,4,37,12,10,29,感性の相性,まずは感性や思いが合うかどうかから。一緒に仕事をするはそれから。,他の人と協業しながら仕事を進めている。,相手をよく知らないままで仕事の相手として組んでしまうと、あとになってズレが生じたときに、プロジェクトを円滑に進められなくなってしまう。,よく知らない相手のことを知るには時間がかかるものである。まして、商談の場は時間も短い上に、仕事面以外の個性が見えにくい。しかし、実際にプロジェクトとしてチームを組んで何かを《一緒につくる》ときには、仕事のスキルなどだけではなく、人として付き合っていく面も大きな要素となってくる。,考え方を理解できるように話し合いを重ね、共感できると確信してから仕事の話を進めていく。,一緒に仕事をしたいと思う相手とは、一度じっくりと話し合い、相手がどのような考え方をする人なのか、一緒に長期に仕事をしていくことが可能なのかを感じ取る機会をつくる。はじめから具体的な企画の話をするのではなく、これまでの自分たちの事業のことを話したり、相手の事業のことを聞いたりするなかで、少しずつお互いのことをつかんでいく。,理解し合える感性をもつ人同士でチームを組むことで、プロジェクトをスムーズに進めやすくなる。そのようなチームで何かを《一緒につくる》ことは自分自身も楽しく、また相手にも《楽しい記憶》として残る可能性が高い。じっくりと確かめ合うことで時間はかかってしまうものの、考え方が合わずに進行が遅れたり、話し合いが成立しなかったりする場合の莫大なコストを未然に防ぐことにもつながる。,Empathetic Partners,See whether you are compatible before becoming a team.,You are collaborating with someone in your work.,"If you continue the project without knowing much about the other person, then there will be a time when you come to a disagreement and the project comes to a standstill.","It takes time to get to know someone that you are unfamiliar with, and it is difficult to understand someone’s personality through business negotiations and meetings. However, when working together on a project through “Flat Collaboration,” it is crucial to get to know your partner as both a business partner and as a person.",Talk with each other until you understand each other’s personality and core values before deciding to become a team. ,"If you think you want to work with someone, then create an opportunity to get to know that person’s way of thinking and imagine how you would work together in the long run. Instead of starting by discussing specific details about the project, you should gradually get to know one another by talking about other topics, such as what projects you have worked on in the past. ","Teaming up with someone who shares the same way of thinking will make the project run smoothly. When you have a good team, “Flat Collaboration” will be more enjoyable, and there will be more “Pleasant Memories.” Although it takes time to get to know your partner, it does prevent future problems, such as disagreements or misunderstandings, which can be critical to the project’s success.",2
64,4,11,6,10,30,一緒につくる,立場や肩書きを超えて、一緒につくるパートナー。,他の人と協業しながら仕事を進めている。,発注側が強くものを言ったり、肩書きによる上下関係から遠慮が生じたりして、プロジェクトのメンバーの中で、本質的な議論ができない場合がある。,仕事でものをつくる際には、発注側と受注側、ベテランと若手など、様々な立場の人が一つのチームを組むことになる。その際、発信力やその機会が、スキルや年齢の差、会社での肩書などの影響を強く受けてしまうこともある。そのように、様々な立場のメンバーが自由に意見できないなかでは、力を寄せ合って良いものをつくっていくことはできない。,プロジェクトに関わるメンバーは、成果をつくっていくためのパートナーであると捉え、全員が対等に議論に参加できるような環境をつくっていく。,ひとつのミッションをもったプロジェクトチームを組む際には、その他の組織の肩書や年齢の差などを持ち込まず、全員がそれぞれにもっている力を出し合うためのメンバーであると考える。もちろん、高いスキルや豊富な知識などをもつメンバーへの敬意や尊重はよいことであるが、だからといってその人ばかりが発言権をもつ状態にしないようにする。,参加者全員が自分の力を発揮するチームとなり、よい成果を生み出すことができる。仕事の品質を上げることを目的として様々な意見を出し合うなかで、互いの個性を理解する機会にも恵まれ、プロジェクトを離れても役立つ関係をつくることにもつながる。ただ、対等といっても、あくまでも意見を出し、議論するメンバーとして尊重されるということであり、経験差や知識差などを考慮すべきでないということではない。ベテランはベテランなりの役割を、若手は若手なりの役割をしながら、チームに貢献することと混同しないようにしなければならない。,Flat Collaboration,Become a real team.,You are collaborating with someone in your work.,There may be times when you cannot have honest discussions with your project members due to differences in position or hierarchy. ,"When working on a project, different people in various positions come together as one. For instance, a team may consist of a combination of experienced and inexperienced people, or those on the client and provider sides. In such a case, there may be times when the skills, ages, and positions of the project members affect the dynamics of the team. If the project members are not on equal terms and they cannot freely state their opinions, then it is not possible to collaborate well and create good output. ","Think of your project members as equal partners that are all working toward the same goal, and create an atmosphere in which all members can freely speak.","Forget about labels, such as age and job titles, and consider all project members as equals that can contribute their strengths to the project. Although it is good to respect members who have significant experience or exceptional skills, they should not be the only ones given the right to speak or make decisions in the project.","All members will be able to actively contribute their strengths to the project, which will lead to good output. Through exchanging many opinions, members will be able to understand one another and develop relationships that will last even after the project has concluded. However, although treating one another as equals is beneficial for discussions, it does not mean that differences in the members’ experience and knowledge should not be considered at all. Moreover, it should not be forgotten that each member should understand their strengths and contribute their part to the team.",2
65,4,36,15,10,31,プロとしての主張,相手を尊重しながらも、言うべき意見はしっかり言う。,他の人と協業しながら仕事を進めている。,さまざまな環境要因やクライアントのニーズに押され、企画者として良くないと感じていることも受け入れてしまうと、企画全体のクオリティを下げてしまう。,クライアントはあくまでもプロの視点ではなく、使い手としての要望を述べているにすぎない。しかしながら、企画者としての経験や感覚から、よりよいアイデアややり方があるとわかっていても、立場の差や場の空気、自信のなさなどから、言うべきことを言えないことがある。,クライアントの思いを実現するための企画のプロとして、自分の考えをもち、しっかりと意見を伝え、話し合う。,クライアントのアイデアをそのまま実現するのがプロなのではなく、他のメンバーがそれぞれの立場で口にする言葉を、この企画により良く反映させるためにはどうすればよいかと考える立場として、しっかりと責任を果たすように努力をする。ときには、反論や説得をしなければいけないとしても、プロとして「私はこう思う」と意見を伝え、できる限りの説明をする姿勢をもつようにする。,高いクオリティのサービスをクライアントに提供でき、最終的には満足を得てもらうことができる。きちんとお互いに言いたいことを出し切って進めていくことで、チームの納得感も高く、《一緒につくる》メンバーであることが感じられ、《楽しい記憶》としても残っていく。また、立場の違う人に企画者としての視点を説明し、議論をしながら提案をアレンジしたり、合意を得たりする経験の中でこそ、自分の企画者としての力を育てることができる。,Professional Opinion,"Respect your client’s opinion, but do not hold back your own opinion.",You are collaborating with someone in your work.,"If you make compromises due to your client’s requests or other outside factors, then the overall quality of the project will decrease.","Clients can only provide opinions from the user’s perspective, which means that their opinions may not be agreeable from a professional’s perspective. Even if your experience and knowledge as a project designer tell you that your idea is better, you may hold back your opinion due to a difference in position or a lack of confidence.","As a professional who is helping to realize the client’s vision, have your own ideas that you can confidently propose to your client, and discuss them together.","A professional is not someone who does exactly as the client wishes, but rather is someone who is able to take the client’s opinions and determine a way to positively incorporate them into the project. Even if this means you must argue against your client, you must give your honest opinion as a professional and attempt to explain your ideas as clearly as possible.","You will be able to provide high-quality service to your client, and ensure their overall satisfaction. If everyone gives his/her honest opinions throughout the project, then the team will be engaging in “Flat Collaboration” and everyone can state their opinions until they come to an agreement. This type of honest teamwork will remain in the team members’ minds as “Pleasant Memories.” Furthermore, you will grow as a project designer during the process of explaining your ideas to people with different perspectives and evolving them through discussions.",7
66,4,34,11,,32,楽しい記憶,「一緒にやってよかった。」それは、満足を超えた賞賛になる。,他の人と協業しながら《一緒につくる》仕事に就いている。,クライアントが期待していたものをただつくるだけでは、期待通りの満足が得られるだけで、それ以上のものにならない。,相手の要望に応えながら、《企画の哲学》を具現化したものをつくることだけがゴールとなると、普通の仕事と変わらなくなってしまう。特に建物のように長く使うものであれば、使い手に愛着をもってもらうことは、その建物の価値を上げる上でとても重要になる。,単に良いものをつくるだけではなく、《一緒につくる》プロセスを楽しいものにする。,企画のプロとして引き受けている以上、良いものをつくることは当然のことである。「一緒にやった仕事、楽しかったよ」と言ってもらえるくらいに「つくるプロセス」を楽しんでもらうことができれば、できたものへの愛着も湧き、つくったもの以上の豊かさをクライアントに提供することができる。,物質的なものだけではなく、愛着や思い入れも加わった豊かなものとして、価値を提供することができる。それは、自分を信頼して依頼してくれた人に、豊かな時間を提供するということでもある。相手が期待していたものが実現されるだけでなく、想定していなかったものも実現したときに、満足は賞賛に変わる。そうなると、次にまた一緒に組むことになったり、積極的な紹介につながったりする。このようにして、自分らしい企画をつくり続けることができるのである。,Pleasant Memories,Go beyond baseline satisfaction.,You are engaging in “Flat Collaboration” with someone in your work.,"If you simply create something within your client’s expectation, then the project will be nothing more than what was already expected. ","If your only aim is to meet your client’s needs and satisfy your “Project Design Principles,” then your work will not be exceptional. If your output is something that will be used for a long time, such as a building, then the project’s value depends heavily on how much the users are attached to the output.","Instead of simply focusing on creating good output, make the process of “Flat Collaboration” enjoyable.","As a professional project designer, creating good output is only an expectation. In order to exceed the client’s expectation and create something they can be truly proud of, it is important to have them enjoy the process of designing the project.","The project will be valuable, not only as a physical output, but also as a product of the team’s collaboration and efforts. By providing your clients with an enjoyable time, you will be able to exceed their expectations and create something that “stays with them.” When this occurs, it can lead to future collaborations and connections to other partners. By linking one opportunity to another, you will be able to continue working on many more projects.",2
67,1,28,2,,0,創造的な学び,自分なりの学びをデザインする。,多角的な視点や想像力を必要とする、複雑な時代に生きている。,創造的に考えるための知識やスキルを学ぶ機会はあまりない。,何かを学びたいと思ったとき、誰かに教えてもらうという方法ばかりに頼ってしまうと、学びに対して受け身な姿勢となりやすい。しかし、何かを変えていくような創造的なスキルは、既存の知識を聞いて覚えるだけでなく、自ら何かを実践するなかで身につき、磨かれるものである。,何かに取り組むプロジェクトをつくり、その活動のなかで他の人たちと関わりながら、考え、学んでいく。,誰かから機会を与えられるのを待つのではなく、自らの興味関心にもとづいて《学びのチャンス》(No.1)をつくる。そしてそのプロジェクトのなかで、《つくることによる学び》(No.2)を実践する。そして、《学びをひらく》(No.3)ことで、新しい発想やより深い学びを得ていくようにする。,学ぶということに積極的な姿勢をもち、自分に必要な学びを自分自身で探し、どんどん進めていくことができるようになる。単に知識を詰め込むのではなく、ものごとや知識・情報の新しい関係性を発見し、自ら意味を編集・構成しながら学ぶことができるため、得た知識を状況にあわせて使い、何かを変えていく経験が増え、ますます学びの重要さ、面白さを感じられる。この力が養われると、様々な情報を自らと結びつけながら捉えられるようになり、自分に関わる問題を発見し、解決していくような、創造的な思考や行動を取ることができるようになっていく。,Creative Learning,Make your learning more creative.,"In a complex and fluid society, it is essential to identify problems and think of solutions from various perspectives and with a creative mind.",Opportunities for improving your creative skills and knowledge are limited.,"\n• There are several ways of learning.\n• The opportunities provided are not always suitable to your needs.\n• To improve your creative skills, it is necessary to learn by constructing living knowledge based on your creative experience, not just by memorizing existing ideas.","Create opportunities for learning by yourself by launching and implementing your own project, and learn through actively creating with others.","Create your own Opportunity for Learning (1) based on your interests, without waiting for someone to provide you with an opportunity. To make this happen, launch your own project, and conduct Learning by Creating (2) as part of the project. Along the way, share your learning process and collaborate with others to deepen each other’s learning as Open Learning (3).",,8
