id,lg_code,cat_code,cat_code_24,axis_no,pattern_no,pattern_name_ja,summary_ja,context_ja,b_problem_ja,problem_ja,b_solution_ja,solution_ja,consequence_ja,pattern_name_en,summary_en,context_en,b_problem_en,problem_en,b_solution_en,solution_en,consequence_en,learning_style_identifier
35,4,25,2,,1,企画の哲学,「かっこよくて、儲かって、意義のあるもの」そういう自分なりの基準をもつ。,企画者として価値を生み出す仕事に就いている。,条件や制約が異なる多くの案件に取り組んでいるうちに、企画に自分らしさがなくなってしまうことがある。,企画にはひとつひとつに異なる条件・制約があり、担当した企画がたまたまヒットすることもある。ある程度の高い確率で安定した質を提供できるようになったとしても、常に高いクオリティを保ち、かつその人らしさが感じられるようなものをつくり続けることは難しい。そうなると、自分に企画を頼む意味が失われてしまう。,自分のつくる企画が満たすべき基準を持ち、すべての企画においてその軸に沿って考え、つくり込む。,企画とはこうあるべきであると感じる、自分にとっての本質的な要素をしっかりと定め、企画を判断する際の哲学としていく。例えば、「かっこよくて、儲かって、意義のあるもの」というような3つの軸を掲げ、それらを満たすように、粘り強く企画を構築する。何を哲学とするのかは人によって異なるので、自分の強みや個性、成功の経験などを踏まえて形づくるとよい。,自分が良いと信じる価値を持った企画を安定して世の中に提供できるようになる。企画者としてのアイデンティティが確立され、自分が手がけたものには自分の世界観が反映される。自分の企画の哲学を達成し続けることで、他の企画者には真似のできない価値を提供でき、その人らしさを確立した企画者となる。こうして、自分がやりたいと思う仕事が舞い込んでくるようになる。,Project Design Principles,Be the judge of your own standards.,You are a project designer whose job is to create new value.,"As you work on projects with various conditions and parameters, you are no longer able to incorporate your personality and strengths into your projects.","Each project comes with its own conditions and parameters. As a result, you may have a “lucky hit” with one project, but not with another. Even if you become sufficiently skilled to create well-designed projects on a regular basis, it is difficult to maintain high-quality performance while also incorporating your personal strengths and uniqueness into the project. If you are unable to create your own unique project, then the clients will not be inclined to use your services.","Set your own principles that you must fulfill in every project that you work on, and use these to guide your thinking when designing any project.","Identify the essential elements that you feel every project should have, and make these your principles that you can refer to at any time when designing a project. For instance, choose three elements, such as “good design, profitability, and social value,” and ensure that you satisfy all of these elements in your projects. Priorities differ from person to person, so you should create your own principles by thinking about your strengths, personality, and experiences.","You will be able to continuously create projects that include values that are important to you. By incorporating your own set of values into your project, you will be able to differentiate yourself from other project designers. Moreover, if you can continue to fulfill your project design principles in your projects, then you will be able to create values that no one else is able to, thus strengthening your identity and professional brand as a project designer. As you continue this approach, you will be more likely to take on additional projects that pique your interests.",7
36,4,17,10,1,2,買ってみる,身銭を切って買い手になることで初めて見えてくることがある。,自分たちが提供するサービスの受け手が、どのような要望をもつのかを知りたいと思っている。,サービスの受け手が実際に感じる気持ちや問題をつかめていないにもかかわらず、企画者目線で「お客様像」をつくってしまい、わかったつもりになってしまうことがある。,サービスの受け手が感じていることを企画者側からイメージするのは難しい。どのようなサービスを望んでいるのかを調査することもできるが、本人たちもはっきりとした答えを持ち合わせていない場合もある。また何か回答が得られた場合にも、それがどのような状況から生まれるのかという背景・認識まで捉えることは容易ではない。こうして、真に解決すべき問題を見過ごしてしまいがちである。,サービスの受け手と同様に、自分のお金を払ってサービスを実際に受け、ユーザーの視点や気持ち、不満や課題を自らの経験として感じ取る。,使う側の心情を、調査や想像だけで済ませてしまうのではなく、実際にサービスを体験し、顧客が何を不満に思うのか、その不満がどの程度のものなのかを身をもって感じ取る。例えば、ホテルについて知りたいのであれば、宿泊客として実際に自分でお金を払って泊まることで、リアルな感覚を得ることができる。,サービスの受け手として感じる心情から、サービスの課題や可能性をつかみ、企画に反映することで、質の高いサービスを提供できる。この経験を繰り返し、受け手側の感覚を意識的に重ねていくと、ユーザーとしての感覚を蓄積でき、企画に反映させる力が高まっていく。もちろん、自分が感じたことだけに頼るのではなく、他のユーザーの声に真摯に向き合うことも大切である。,Become a Real Customer,Some aspects are only visible when you pay out of your own pocket.,You want to know what your customers are looking for through your services.,You make assumptions and think you know your customers without actually understanding the customer experience.,"As a project designer, it is difficult to imagine how your customers feel about your service(s). You could survey your customers to see what their expectations and demands are, but customers do not always know what they want. Even if they do provide you with some insight, it is difficult to determine what type of circumstances led to these customer experiences. As a result, you may overlook the real problems/concerns that customers have and make false assumptions.",Experience your own service by paying for it with your own money and see what types of problems/inconveniences you encounter as a customer.,"Instead, of estimating/guessing the customer’s feelings through surveys and your imagination, experience your service the way they do, and see for yourself how your customers feel. For instance, if you are running a hotel business, you can get a real sense of what a customer experiences by paying for a room and staying at the hotel as a guest. This will also help you determine what parts of the service(s) you found unpleasant.","You will be able to provide better service by experiencing the problems (and possible changes in your service) firsthand and reflecting on them in your project. You will also begin to have a keen sense of your customers’ needs, especially if you deepen your understanding of your customers. Needless to say, it is also important to listen to other customers’ voices and reflect their opinions in your project.",1
37,4,1,7,1,3,直に仕入れる,現場でしか得られない情報がある。,新しい企画を立てるために、情報を集めている。,誰かが提供している二次情報のみで考えようとすると、偏った視点・情報のまま判断を下してしまう恐れがある。,人から聞いた話やインターネットで調べた情報は、事実の一部を誰かが解釈して切り取ったものである。その情報をまとめた人は、自分の企画に必要な観点で現場を見ているわけではないため、自分にとって必要な情報がすべてまとめられていることはない。このように、二次情報を情報源にすると、企画に必要な情報を落としてしまうことがある。,現場に足を運んで、そこで得た一次情報をもとに考える。,現場に行って、そこでしか得られない情報を自分で手に入れ、それを元に企画を考える。一度だけでなく繰り返し現場に足を運ぶなかで、その地域の人と顔なじみになったり、地域の特色を聞いたりと、自分しか得られない生の情報を得るように努力する。,現場周辺の環境や雰囲気、そこで生活している人たちの考え方や言動など、ネットや雑誌にはない、自分で手に入れたリアルで詳細な情報をもとに企画を考えることができる。自分だけの一次情報を得ることで、他者には立てられない独自性のある企画にでき、自分の個性も加えられるとともに、他人の見方に左右されずに、自信をもって企画を進めていくことができる。,Direct Sourcing,"Get fresh, direct information.",You are gathering information for a new project.,"If you rely solely on secondary knowledge, then you may end up making decisions based on biased information.","Information that you find on the Internet or hear from secondary sources provides only pieces of the truth. For instance, the person who gave you the information may not be someone that knows everything about the subject. As a result, you may not be getting everything there is to know about the subject. In this regard, relying on secondary knowledge may cause you to overlook information that is necessary for your project.",Go to the source of the knowledge and consider ideas based on the knowledge you find there at first hand.,"Base your project ideas on information that can only be found by going to the source and asking for it firsthand. Try to find fresh information that only you can find, by going to the source many times until you get to know the people and learn about the characteristics of the area.","You will be able to create a project based on information that people would not find on the Internet or in magazines, such as the environment/atmosphere of the project’s location and the lifestyles/ways of thinking of those that live there. By going out and getting information at first hand, you will be able to create a project that no one can imitate. You will also have full confidence in your ideas without being influenced by others.",1
38,4,2,1,1,4,体感判断,その場に立ち、自らの五感で感じとる。,企画をつくるための情報を集めている。,人から得た情報にもとづくだけでは、現場の状況や環境に合わない企画になってしまう可能性がある。人から得た情報にもとづくだけでは、現場の状況や環境に合わない企画になってしまう可能性がある。,メディアから得られた二次情報のみならず、現場の人が語る一次情報を得たとしても、それらは、あくまでもその人たちの認識にもとづく情報でしかない。現場の世界は、膨大な情報と可能性に溢れ、もっと多様な解釈に開かれている。,現場で自らの五感で感じたことを大切にし、企画の判断に使っていく。,現場に行ったときには、音や雰囲気、香り、周囲との調和の仕方など、現場全体から感じられることを大切にし、五感を使いながら考え、理解を深める。そうすると、これまでの企画の経験やプロとしての視点・知識をもつ自分だからこそ感じられるものを得ることができるだろう。このように、現場に立って自分がどう感じたのかということに注意を向け、ワクワクしたり、気持ちが高まったりしたことや、発見や驚きがあったことを企画に盛り込むようにする。,こうして集めた情報・感覚を企画の判断に入れていくことで、現場にフィットしたものでありつつ、自分らしさが反映された企画になっていく。また、五感で感じると実感するので、後に情報として引き出しやすくもなる。,On-The-Spot Feeling,Feel the atmosphere by using your five senses.,You are gathering information for a new project.,"If you rely too much on information that you hear from other people, you may end up creating a project that does not actually suit the situation and atmosphere of its location.","Even if you go and obtain firsthand information from the people that live in the area where the project will occur, such information includes the opinions of only a limited group of people. Thus, it is not only through talking to people that you can gain insight for your project.","Note what you feel with your own senses, especially when you visit the project’s location, and use them in your decision-making.","Deepen your understanding of the project’s location by using all of your senses. In other words, note the atmosphere of the location, including the sounds, smells, and how the place works with its surroundings. By observing all aspects of the location from a project designer’s perspective, you will be able to make unique observations that could give you hints about what you can do with the project. Thus, make a note of what you felt from visiting the site and incorporate those aspects that you found exciting or interesting into your project.","By using your own findings and feelings in your project decisions, you will be able to create a project that both suits its location and has elements of your uniqueness. Furthermore, going to the project’s location and gathering information through your own senses will make it easier to recall this information at a later time.",1
39,4,3,5,2,5,偶然の取り込み,いま出会ったこの面白いこと、どうプロジェクトに活かせるだろうか?,現在進めているプロジェクトとは関係のないところで、偶然面白い体験や情報に出会った。,その面白い体験や情報を、プロジェクトとは関係がないと切り離してしまっては、企画をよりよくするチャンスを逃してしまう。,イノベーションは「新結合」であると言われるように、一見関係のないものが組み合わさることで、これまでにない新しい発想の企画が生まれることがある。日常のなかで面白いと思った感覚を、プロジェクトとは別の次元のことだと片付けたり、それを「いつか使いたい」と漠然と思ったりするだけでは、日々の流れのなかでその感覚や記憶は薄れてしまい、結局は活かせなくなってしまう。,面白いと思ったら、「いまの自分のプロジェクトに活かせないか?」と、とことん考えてみる。,24時間どんなときでも、面白いことが起きるかもしれないと考えて、プロジェクトと結び付ける気持ちの準備をしておく。実際に面白いと思う体験や情報があったら、それが面白いと感じられる理由をつかみ、自分のプロジェクトに活かすことを考えてみる。今取り組んでいるプロジェクトに適した活かし先がない場合には、今後あり得るどんなプロジェクトであれば、活かすことができそうかを考え、メモをしておく。,日々の生活のなかで得た刺激をプロジェクトにうまく活かすことができる。また、それを実現するために新しい仲間と組み、活動の幅が広がっていくこともある。さらに、日頃から複数の要素を関係づけて考える習慣がつき、偶然出会ったよい情報と企画に接点をもたせる力も身についていく。,Chance Taker,How can you incorporate this exciting idea into your project?,You encountered an exciting experience or exciting information that is unrelated to your ongoing project.,"You assume that an exciting experience/exciting information has nothing to with your project, thus wasting an opportunity to make your project more interesting.","An innovative project is often the result of a combination of seemingly unrelated elements. However, even if you encounter something new or exciting, you may not thoroughly think about how to incorporate it into your current project. If you leave out ideas or “save them for another time,” then they will slowly fade from your mind and become a wasted opportunity.","When you find something exciting, determine whether you can incorporate it into your current project.","An exciting idea could come to you at any time. Thus, you must be ready to be flexible and think of ways to incorporate it into your project. When you do find something interesting, ask yourself why you find it interesting and which part of it could be used in your project. If there is no way for the idea to be used in your current project, then think of future projects in which you could use it and make a note of it in order to recall it at a later time.","You will be able to make use of your everyday experiences and findings in your projects. Through the process of trying to realize your idea, you may collaborate with new people and expand your work. You will also gain the ability to find connections between various things and apply serendipitous encounters to your project.",8
40,4,32,7,2,6,自分なりの引き出し,発想の種は、すぐに使えるかたちでしまっておく。,日頃から情報収集を心がけている。,たくさんのものごとを見聞きしていても、いざ企画を考えようとするときに、それをうまく活かすことができない。,情報の意味を深く考えずに蓄えていると、一般的なカテゴリーでその情報を記憶しているだけにとどまってしまう。すると、いざ企画を考えようというとき、それまでに蓄えた記憶の中から、どのような情報が関連しているかやどの事例が参考になるのかを探りあてることができず、もっている情報を自分の武器として活かすことができない。,得た情報を自分の基準や視点で捉え、「発想の種」として引き出せるかたちで蓄積していく。,コンピュータのなかに写真をためておくときなどに、自分なりのインデックスをつけて蓄積しておく。そのとき、インデックスは「素材」や「食べ物」といった一般的なカテゴリーではなく、「魅力的な空間」「どこかで使ってみたい技術」など、自分の発想と紐づきやすいようにつけていくようにする。細分化して分類するのではなく、雑多な感じでしまっておくと、発想を刺激しやすくなる。,自分の興味や関心、インスピレーションなどと紐づいた情報を発想の種として使うことができるようになる。発想の際には、関連するインデックス以外のものをあえて見て、なかば強引にアイデアを考えて見るということも有効である。このような経験を積むことで、情報を一般のカテゴリーとは異なる結びつき方で蓄えられ、独自の視点から考えやすくなる。,Personal Stock of Resources,Store “seeds” of ideas in such a way that you can easily find them later.,You are constantly gathering information that could help you generate new ideas.,"Although you are taking in a lot of useful information, you are unable to make use of it in your projects.","If you take in a lot of information without thinking deeply about it, then you are merely memorizing all of the information under a general category. In this case, you will be unable to extract/recall the related information or refer to relevant examples when you need them, which means you are not taking advantage of your knowledge.",Categorize the information in your own way and store “seeds” of ideas that you can recall or refer to at any time.,"When, for instance, you are storing photos on your computer, index the photos by category. These categories should not be general classifications, such as “materials” or “food,” but something that correlates to your way of thinking, including “attractive spaces” or “technology that could be used for future projects.” The information is more likely to trigger ideas if it is classified miscellaneously, rather than divided into many specific categories.","You will be able to use information based on your interests and inspirations as “seeds” of new ideas. When you are trying to generate new ideas, it is also possible to intentionally look at unrelated categories and push your imagination. By utilizing this process, you will be able to distinguish pieces of information from general categories and find relationships between them, based on your own perspective.",1
