id,lg_code,cat_code,cat_code_24,axis_no,pattern_no,pattern_name_ja,summary_ja,context_ja,b_problem_ja,problem_ja,b_solution_ja,solution_ja,consequence_ja,pattern_name_en,summary_en,context_en,b_problem_en,problem_en,b_solution_en,solution_en,consequence_en,learning_style_identifier
84,1,8,8,6,17,プロトタイピング,形になるといろいろな面が見えてくる。,アイデアが形になりそうだと感じている。,頭のなかで考えているだけでは、これからつくるものの問題点や可能性に気づきにくい。,何かをつくる際には、実際に手を動かしてみることで初めて気づく問題点があるものである。そのため、構想を練るばかりで手を動かさないままでいると、アイデアの問題点に気づくのが遅れてしまうことがある。また、周囲の人にアドバイスや意見を求めようとしても、具体的な事物がない段階では、イメージがうまく伝わらず、建設的な議論ができないことも多い。,プロトタイプ（試作品）をつくることで、様々な可能性を吟味し、よりよいものを目指すことができる。,まずは、クオリティが低くてもよいので、プロトタイプをつくってみる。そして、つくる過程で新たに検討しなければならないことを見つけたり、できたものと思い描いていたイメージとの違いを確認したりして、構想を練り直すヒントを得る。さらに、試行錯誤しながらいくつかプロトタイプをつくることで、様々な選択肢の中からよりよいものを選んでいくことができる。そして、プロトタイプを用いて周りの人とイメージを共有し、そこで得られたフィードバックを最終的なアウトプットに反映させる。,実際につくって試しながら計画を練っていくことで、効率的に高いレベルの成果物をつくっていくことができる。政策やビジネスにおいても、「特区」や「テストマーケティング」というかたちでプロトタイピングは行われているように、多くの物事は《小さく生んで大きく育てる》(No.33)という考えで、まずは計画を形にして他者の視点も入れながらつくりあげられていくのである。,Prototyping,It is not until you create prototypes that you figure out what you really want to make.,You have an idea and are almost ready to implement it.,You cannot clarify an image of what you will create.,\n• It is not until you take steps to achieve the objective that you find it clear.\n• Making things opens possibilities to enter your next stage of learning.\n• It is difficult to discuss an idea without a concrete image of it.,Create prototypes and consider how to improve them.,"Create a prototype and find out what doesn’t work. Consider other approaches to your problems and re-create the prototype. Using the prototypes, share your ideas with others and create better prototypes than before.",,5
85,1,1,23,6,18,フィールドに飛び込む,行ってみないと、わからないことがある。,実社会や現実の問題について学び、考えている。,資料から情報を得てまとめるだけでは、その対象を表面的にしか理解できない。,ある対象について書かれたものは、ある人の視点から見た情報でしかなく、対象そのものではない。それらは、自分に必要な視点で書かれているとは限らないし、また、対象に直接触れられる現場に行かなければ分からないことも必ずある。そのため、書かれた情報だけを参考にしていては、対象を深く理解するには到りにくい。,フィールド(現場)に飛び込み、「当事者」と作業をともにしながら、「外部者」としての視点や知識と結びつけて考える。,教育であれば学校や教室、建築であれば設計現場や実際の建物、社会問題であれば課題が感じられる場所やそれに関する会議など、現場となる場所を探して足を運んでみる。そして、当事者と行動をともにするなかで、「なぜそうするのか」をその場で問い、行動や活動の背景を理解する。また、フィールドでの現象を、事前に学んでいた理論と照らし合わせて理解を深めるのもよい。その際、気持ちが現場に入り込みすぎてしまうと目の前のことに翻弄され、客観的な視点を失いやすいので、フィールドで何をしたいのかの目標をもち、ぶらさないことを心がける。,現場にしかない具体的な生の情報を得て、周辺の様々なこととのつながりを知り、対象の理解を深めることができる。《まずはつかる》(No.4)という気持ちで、そこにいる人たちの行動を《まねぶことから》(No.5)始め、いろいろなことを体験していくことで、行動のつながりや思考・心情など、テキストにはないような幅広い細かな情報を知ることができる。自分が取り組んでいる問題の意味を肌で感じることができ、《探究への情熱》(No.22)を高めることにもつながっていく。,Field Diving,It is not until diving into the field that you touch upon reality.,You are thinking about and interested in an actual problem.,You cannot touch upon reality only by referring to documents.,"\n• A description of a subject is not the subject itself.\n• In the field, knowledge exists on the spot.\n• Some things are certain or clear to some people, but not to the others.\n• The deeper you are in the field, the more you lose objectivity because you are inevitably affected.",Dive into the field and work with the people actually concerned while maintaining an outsider’s viewpoint.,"Search for a field that you are interested in. Dive into the field, and observe what is going on. Understand the context and intention of the activities while interacting with the people concerned. Deepen your understanding of reality by reconsidering your experiences from a certain perspective.",,1
86,1,30,17,7,19,鳥の眼と虫の眼,その二つの視点を行き来する。,物事をより深く理解したり、表現したりしたい。,全体を見ているだけでは細部はわからず、部分に注目するだけでは全体を見失う。,同じものを見ていても、どういった視点をもつかによって見えてくるものは異なるものである。したがって、細部を観察したり細かい部分をつくり込んだりしているときには、全体が見えにくいし、逆に、俯瞰的な観点で物事を見ているときには、詳細を見落としてしまいがちになる。かといって、俯瞰的な視点と詳細な視点の両方を同時にもつことも難しい。,全体を俯瞰する視点と、細部をきめ細かく見る視点とを切り替えながら、物事を考えていく。,ある視点での作業に一区切りがついたら、次は細部から俯瞰、または俯瞰から細部へ視点を切り替えて見つめ直すことを意識的に行う。たとえば、論文執筆において、本文内の表現を突き詰めているときには、論文全体のなかでの位置づけを確認するようにして、今つくり込んでいる表現が適切かを見直してみる。逆に、論文の全体像を考えているときには、ときどき、個々の章で何を書くのかの具体的なイメージを膨らませる時間をもつようにする。,全体的な位置づけやバランスもよく、細部の詰めもしっかりした考えに至ることができる。また、自分の活動に対して鳥の眼と虫の眼をもつことは、《広げながら掘り下げる》(No.20)ためにも、《セルフプロデュース》(No.38)のためにも重要となる。さらに、論理と感覚の思考モードを《右脳と左脳のスイッチ》(No.22)で切り替えることと併せて行うと、様々な視点からの深みをつくることができる。,A Bug’s-Eye & Bird’s-Eye View,"Alternate between two points of view: look at the whole, then look at the details.",You are studying what you want to understand or working on creating an output.,You have trouble improving the quality of an idea or mediocre result.,\n• What is seen depends on the viewpoint.\n• It is difficult to view the whole while focusing on details.\n• It is difficult to focus on details while looking at the whole.\n• It is difficult to have two viewpoints simultaneously.,Alternate between viewing the whole and details.,"Be aware of the details when working on something from a whole viewpoint (bird’s-eye view). For example, if you’ve thought of the whole, create a specific image of the content. Then, be aware of the whole when working on something from a detailed viewpoint (bug’s-eye view). For example, if you’ve searched for an appropriate expression in your paper, confirm the context. Change the viewpoint and repeat the process several times or as many times as you can.",,5
87,1,30,20,7,20,隠れた関係性から学ぶ,意外なつながりこそ面白い!,物事をより深く理解したり、新しい発見をしたりしたい。,既存の分類や関係性に囚われていては、これまでにない視点や新しい発想は得られない。,世の中にあるものの多くは、すでに既存の基準で分類され、関係性が整理されている。そのため、何かを理解するときには、自分ならではの視点で意味づけることは難しく、既存の分類でしか見ることができなくなりがちである。,物事の背後にある「隠れた関係性」を探究し、そのつながりに着目することで、これまでとは異なる視点や発想を得る。,今ある分類は、かつて誰かが決めた基準にすぎないことを意識し、自分の観点から物事の関係性を探すようにする。例えば、分野を超えて使われている言葉や、論文・書籍で参照されている文献、研究者の交流関係などから、共通項を考え、隠れたつながりを把握してみる。要素の数が多い場合には、それらがどのように関係づけられているのかを図にマッピングすることで、関係性の全体像をつかみやすくなる。,一般的な捉え方に囚われず、自分自身の視点で社会や事象を捉えていくことができるようになる。《学びの竜巻》(No.10)をつくり、《広げながら掘り下げる》(No.20)なかで、自分の専門と他の領域との関係性を捉えることができれば、これまで誰も着目していなかっ���分野を超えた発見をし、分野の発展に寄与することができる可能性もある。新しい関係性に気づくことができたときには、心から《知のワクワク!》(No.5)を味わうことができるだろう。,Hidden Connections,An unexpected connection is exciting.,You are studying something from a typical viewpoint.,Unexpected discoveries hardly manifest from conventional classifications.,\n• It looks good if it is what you are already accustomed to.\n• It is necessary to find new meanings of connections between things when you apply a new viewpoint.\n• Increasing the number of elements makes if difficult to grasp the whole because the connections between them are drastically increased.,Explore hidden connections between things for inspiration.,"Find hidden connections between different fields that share the same terms.Think about how and why these things are connected, and make a new category for each connection. Then, consider other things that can be connected to the new category.",,4
88,1,29,8,7,21,広げながら掘り下げる,深く深く掘るためには、まわりも掘らなければならない。,ある分野のことをより深く学びたいと考えている。,同じような範囲の情報に触れているだけでは、あるところで限界に行き当たってしまう。,日本語の読解力が数学の文章問題を理解する力に結びつくように、あるいは、経済学が他の社会科学の学問や数学と結びついているように、単独で存在している分野はない。ある知識は、それと関連する他の知識と相互に依存しあっているのである。そのため、ある分野だけを掘り下げていっても、その中だけを見ていると、あるところで理解を深める限界がきてしまう。,ある程度の理解が進んだら、その周辺のことについても学び、関係づけながら、さらに知識を深めていく。,ひとつの分野・テーマを掘り下げるときには、初めの段階ではその分野に関することを徹底的に学び、理解を深めていく。そして、その分野のことはだいたいわかったと言えるぐらい、ある程度の理解が進んだと思えたら、視野を少し広げてそれに関係する概念や分野を学んでみる。例えば、ある言語のプログラミングのスキルを身につけた後は、別のプログラミング言語を学んでみたり、開発方法論やアーキテクチャについて学んでみたりする。,中心となるテーマを、他とのつながりのなかで多面的に理解することができる。そのような理解ができるようになれば、得た知識を応用して、問題を解決したり、自分にしかできない発見ができたりするようになっていく。《量は質を生む》(No.12)ことを意識して徹底的に取り組むとともに、《鳥の眼と虫の眼》(No.19)をもって全体のなかの位置づけを把握しながら学んでいく。他の物事と結びつくことで、《知のワクワク》(No.11)をますます感じることができるだろう。,Triangular Dig,Broaden the hole if you want to dig deeper.,"You’re interested in something, but you have only a shallow understanding of it.",It is difficult to develop your understanding of what you almost know.,\n• Knowledge does not exist alone but is embedded in the web of knowledge.\n• Knowledge comprises various abstract levels.\n• Not all related knowledge falls in the same category.,"Acquire knowledge indirectly related to what you want to understand, and you will understand it better.","First, acquire knowledge in the same category of what you want to learn, and you will understand its features. For example, if you learn Java language, gain knowledge on other programming languages (e.g., C language). This will help you better understand the features of Java. Then, acquire knowledge related to what you want to learn and reconsider its meaning in relationship to this knowledge. For example, if you learn Java, gain knowledge on algorithms and data structures, design patterns, and computer architecture. Then, you will understand the background of Java and the meaning of that language in each relationship to the acquired knowledge.",,8
89,1,32,13,8,22,探究への情熱,情熱がもてないことを、最後までやり抜くことは難しい。,自分が深く学んでいく分野や専門、研究テーマを決めようとしている。,魅力的に見えた分野・テーマであっても、自分が取り組む意義を見出せないと、長く続けることはできない。,研究テーマは社会的ニーズや学問的発展も視野に入れて決める必要があり、自分の興味や意思だけで決められるものではない。しかし、「社会・学問にとって必要」という観点だけで選んでしまうと、研究活動の過程で、ここまで自分がやらなくても構わないのではないかと思ってしまい、労力を注ぎ続けることができなくなってしまうことがある。研究は、これまでにないものを創り出す先端領域の活動であるため、「生みの苦しみ」が伴うからである。,「自分が取り組む」ということをしっかりと意識し、情熱や愛情をもてるテーマを選ぶ。,研究テーマを選ぶ際には、どうしてもこれだけは解決したいという問題への「憤り」や「焦燥感」、または、研究対象への「愛」といったような、感情が動くテーマを考えてみる。そのようなものは、自分の中を一生懸命探すというよりは、世の中のこと・最先端のことをいろいろと眺め、調べながら感じとっていくとよい。その上で、自分が情熱をもてるテーマがどのように社会的ニーズとつながるのか、研究が進めば世の中の何が変わるのか、そして、学問の発展に寄与するのかという観点で深めていく。,長く続いていく研究活動の対象として、自分自身のやりがいを感じて折れずに進めていけるテーマを選ぶことができる。探究への情熱をもてるテーマが見えてきたら、それを軸にして、これまで培ってきた様々な学び方を実践していくことで、最先端に近づいていく。そして、《知のワクワク!》(No.11)を味わいながら研究を加速させていくことで、《突き抜ける》(No.39)ことができるだろう。,Passion for Exploration,It is difficult to carry out hard explorations without passion.,"After acquiring knowledge and improving skills, you finally need to choose the subject you will now explore.",It is difficult to choose a subject to explore.,\n• There are many subjects in many fields.\n• You never know untill you try.\n• It is difficult to continue working hard for something you are not required to do.,Choose a topic that you can be passionate about — something that you can “love” or are “passionate” about.,"Consider what issues you are interested in or aware of. Your interest is what you love, and your awareness of issues is what you are angry about. Find a field related to your interest or awareness of the issues. Also, make your topic more concrete in the field. Reconsider your topic according to social needs and academic contributions.",,6
90,1,30,17,8,23,右脳と左脳のスイッチ,論理と感性、その両方が必要だ。,何かを本気でつくり込んでいる。,論理だけに任せても、感性だけに任せても、たいした飛躍は期待できない。,論理的(左脳的)な思考は、分析や推論を促し、感性的(右脳的)な思考は、豊かな発想や表現を促す。しかし、論理的な思考と感性的な思考は、両方が自然にできるよりも、どちらかの方が得意な人が多く、思考のしかたは偏ってしまいがちである。かといって、論理と感性の両方の思考を同時に駆使することは難しい。,論理的な思考と感性的な思考の二つのモードを切り替えながら、物事に取り組む。,論理的な、または感性的な思考で突き詰めた結果、納得のいくレベルに到達したときや、あるいは行き詰まりを感じてしまったときは、別の思考のモードに切り替えるようにする。例えば、論理的に考えていたときには、美しさや豊かさを、感性的に考えていたときには、論理的な整合性を考えてみる。文章で書いていたことを図にしたり、絵の説明を文章で書いてみたりするなどもよいだろう。,異なる二つの考え方を使えるようになることで、理解や表現が深く質の高いものになる。また、《鳥の眼と虫の眼》(No.19)による視点の切り替えも併せることで、自分でアイデアを高める思考ができるようになる。このようにして表現されたものは内容的にも表現的にも質が高まるので、その経験は《魅せる力》(No.25)を磨くことにもつながっていく。,Brain Switch,Both logic and intuition are necessary for creative thinking.,"You are creating an output, and you’ve made some progress.",Logical thinking is not sufficient to achieve a breakthrough without intuitive thinking and vice versa.,"\n• Logical thinking promotes acute analysis, inference, and persuasion.\n• Intuitive thinking inspires good ideas, expressions, and impression.\n• It is difficult to be logical and intuitive simultaneously.",Switch between the two modes of logical and intuitive thinking.,"If you begin to think logically, deliberate as logically as possible. If you begin to think intuitively, exercise imagination as intuitively as possible. Switch thinking modes when you reach a dead end. If you have thought logically, modify to more attractive expressions. For example, when you are writing, draw pictures of what you want to express in words. In contrast, if you have thought intuitively, modify to achieve greater coherence. For example, when you come up with a new idea, think of the logic behind it. By switching thinking modes, you can find new perspectives.",,7
91,1,6,8,8,24,小さく生んで大きく育てる,何度もバージョンアップさせて大きな成果へ。,大きな成果を出したいと思っている。,いきなり大きな成果を出そうと意気込むと、達成までに時間がかかりすぎて、途中で挫折しやすい。,なにかをつくるには、時間と手間がかかり、成果や効果はなかなか見えてこないことが多いものである。しかし、それが見えないと、途中で自分の取り組みの意義を信じられなくなったり、楽しさを見出せなくなったりしてしまい、持続して取り組むことが難しくなってしまうこともある。また、そもそも大きな成果を出すことは難しいことであり、思う成果に到達できないと感じることは、頻繁に起こることである。,まずはアイデアをアウトプットすることに集中し、それを徐々に大きな成果に育てていく。,自分がやりたいことを思い描き、小さな規模でも具体的なかたちにして、周囲に発表する。大きな構想がある場合には、その構想の縮小版や一側面を表現したものでよい。そして、そのアウトプットに対して周囲から感想や意見をもらい、肉付けをしていくことで徐々に成長させていく。,小さくても一つの成果を出すことができれば、自分が取り組んでいることに対する手ごたえを感じ、取り組みを続けるモチベーションを保つことができる。そして、成果をアウトプットすると《学びをひらく》(No.3)ことができ、他者と相談したり、一緒に取り組む人を増やしたりしながら、大きな活動に成長させやすくなっていく。どんなに大きな成果でも、最初は小さな成果から始まっており、多くの人の中で育てられていくことで、社会を変える力を備えた活動にしていくことができる。,Fruit Farming,"Start small, nurture growth, and your activity will bear fruit!","You are planning to create an output, but your vision might be too big.",It is difficult to produce a big result at once.,\n• It takes a long time to produce ripe fruit.\n• It is difficult to keep working on a task when your efforts seem ineffective.\n• A concrete result allows you to move forward with the next plan.,"Do your best to shape your idea, and then nurture it.","Clarify what you want to do. To achieve steps, nurture your idea and develop concrete results. At this stage, your fruit will still be small. Then, show your results to others. If some colleagues are interested in your activity, invite them to join you. Continue nurturing your ideas until your results bear fruit!",,8
