id,pattern_no,pattern_name_ja,b_solution_ja,pattern_id 紐づくパターンのIDを入れてください。
1,1,ピンとくるもの,はじめが肝心だと思うと、何から始めたらよいかわからなかったり、結果が出るのかを考え込んでしまったりして、なかなか実践に踏み出せないことがある。そういうときには、「これやってみたい」「これ面白そう」と思うことを見つけ、あれこれ考えずにまずは実践を始めてみる。最初から最短ルートで確実に大きな成果をあげるということを目指してしまうと、動き出せなくなるので、まずは実践してその結果から学ぶということが、出発点だということを理解することが大切である。,2
2,2,できる範囲のこと,周囲の理解や組織的な制約などによって、容易に実践を始められないときには、その状況の中でもすぐにできることを見つけてみる。例えば、稟議が必要ないことや、自分の裁量の範囲でできることを探してみる。,2
3,3,先輩への相談,自分ひとりでは何から始めればいいのか決められないときには、実践を進めている先輩に、自分の状況や悩みなどを話して、何から始めたらよいかをアドバイスしてもらい、その内容をヒントにしてはじめの取り組みを決める。,2
4,4,業種・業態を超える,自分の店・会社とは遠い事例ばかりで、そのまま真似できそうなことが見つからないと感じるときには、その事例の何をどう置き換えれば自分のケースと重なってくるか、自分の状況で似ているところはないかを探すことで、他業種や他業態の事例も自分事にしていく。,3
5,5,自分の場合への置き換え,業種・業態が違う事例などを真似するときには、自分の店・会社や、扱っている商品・サービスの内容に合うように、置き換えて真似するようにする。例えば、店舗での事例を、ウェブショップで真似するときには、リアルな場でのことを、ウェブ上だとどう実現できるかを置き換えて考える。,3
6,6,なりたい人探し,色々な事例に触れたり、先輩の話を聞いても真似てみたい事例がみつからないときには、自分もこうなりたいと思う人や店・会社のモデルを見つけ、その人や店の軌跡ややっていることを真似てみるのもよい。,3
7,7,行動の変化,自分の実践の成果を確認するときには、新たに働きかけたことによって、どういった行動の変化が起こっているのかを実践前と比べる。例えば、問い合わせの数やその内容がどう変化したか、また店頭であれば、立ち止まる人や手に取る人がそれぞれにどう増えたかなどを丁寧に見ていく。,4
8,8,空気の変化,《行動の変化》だけではなく、従業員やお客さんの表情、店・会社全体が醸し出す雰囲気の変化も、実践に対する反応のひとつとして、積極的に読み取るようにする。例えば、かけられる声の内容がなんとなく変わってきたり、またお客さんから「店の雰囲気が明るくなった」など言われたりとしたら、それは成果が出ているということだと捉える。,4
9,9,自分の変化,《行動の変化》や《空気の変化》を気にするなど、自分の着眼点や考えることが変わってきたことも客観視するようにして、今までになかった自分を見つけ、それも取り組みをはじめたことによる変化だと捉える。,4
10,10,時間差の織り込み,取り組みによっては、結果が出るのに時間がかかるものがあるので、時間がかかるということを織り込み、焦らずに変化を見るようにする。そうすることで、すぐに反応が起きることを期待してしまい正しく検証ができなかったり、長期スパンという観点が抜け落ちて、やることが狭まったりしてしまうことを防ぐことができる。,4
11,11,凹まず続ける,実践したことに対して、「興味がない」「もう送ってこないで欲しい」などネガティブな反応を受けることもある。そんなときには、ごく一部にネガティブに感じる人もいるとしても、多くの人はそうではないということも事実であると意識し、悲観しすぎることなく、実践を続けていく。,4
12,12,なぜそれをやるのか,実践をある程度するようになったら、何か取り組みをやるときには、なぜそれをやるのかをきちんと考えるようにする。,5
13,13,なぜそうなったのか,何か取り組みをしたあとには、なぜそういう結果になったのかをしっかり考えるようにする。,5
14,14,考えるための書き出し,自分の実践を伝える・まとめるなどの機会を積極的に利用し、自分のやったことを改めて言語化・文章化したりする。書きまとめてみる過程で、思考が整理されたり、今まで気づかなかったことを発見したりすることができる。,5
15,15,反応がないことも反応,《行動の変化》を見ようとしても、何も見つからないときがある。そんなときには、反応が起きなかったことも反応のひとつと捉え、なぜ何も起きなかったのかを考えるようにする。,5
16,16,好きを入れていく,自分ならではのアレンジやオリジナルの取り組みを考えるときには、自分が好きなことを入れてみて、自分らしい発想の取り組みをつくっていく。ただし、お客さんを無視した自分勝手なものにならないように、お客さんに喜んでもらえているかをよくみることが大切である。,6
17,17,小さく始めて探る,新しい取り組みであるほど、実際にお客さんに喜んでもらえるのかはわからないので、小さく試験的に始めてみて、お客さんの反応を探りながら、規模を大きくしたり、度合いを色濃くしていく。,6
18,18,唐突でもよい,これはよいと思ったアイデアでも、業種・業態の常識を踏まえると「唐突」だと思ってしまい、せっかくのよいアイデアも躊躇して実践しないということがよくある。しかし、自分が心配はよそに、お客さんからは好評だったり、面白がられたりと、反響があったりすることもあるので、試してみるとよいだろう。,6
19,19,悩みのレベル,今足踏みをしているように感じているのは、実践を始めたときに比べて、悩みのレベルが上がってきているために、新たに多くの悩みが見えてきているのかもしれない。その悩みが見えたということが、飛躍のすぐ手前にいるということだと捉えるようにする。,7
20,20,そのまま続けていく,伸び悩んでいると感じているときは、何か新しいことやレベルの高いことをしなければならないと思ってしまいがちである。そういうときこそ、今まで通り、そのまま実践を続けて行くことこそが大切であると考え、地道に実践を重ねていく。,7
21,21,たまには休んでもよい,どうしても疲れたと感じるときには、実践を続けることをやめるのではなく、「お休み」をして、充電する時間を取るようにする。,7
22,22,先にある世界,実践を続けていても、苦しさや閉塞感を感じてしまうことがある。そんなときには、ここを乗り越えた先輩たちと話し、《テイクオフへの助走》を超えたところにはどのようなことが待っているのかなど、この先に続く世界を教えてもらうとよい。,7
23,23,理論と実践の往復,本質をつかもうとしても、なかなか捉えられない。そんなときには、実践して起こったことは、理論でいうとなんなのかを確認したり、逆に、理論から自分の実践を考え出したりしながら、理論と実践を何度も往復するようにする。,8
24,24,出来事の本質,事例・具体例に触れるときには、そこで起こったことを表面的に読むだけではなく、理論で説明しようとするとどういうことだと言えるのかを考えながら読むようにする。そうすると、具体と抽象を行き来する力がつき、日々の実践の中でも本質を捉えることができるようになっていく。,8
25,25,同じ理論に何度でも,以前に読んだ本、出たセミナーなどを通じて一度聞いたことは「もう理解した」と思ってしまいがちだが、何度も繰り返し触れてみるようにする。同じ内容であってもその都度、必ず新たな発見があり、認識がアップデートされていく。,8
26,26,しかけの散りばめ,つながりを意識しながら実践をするのが難しいと感じるときは、色々なところに仕掛けを散りばめておくとよい。そうすることで、一見バラバラに見えていた仕掛け同士のつながりが見えてくるようになる。,9
27,27,ミッシング・ピースを埋める,《全体のつながり》がわかるようになってきたら、商売やビジネスといった大きな枠組みの中で自分が取り組んでいないパーツはどこか、何を埋めたらもっとスムーズにつながるかなど、大きな動きを生み出していくために不足している部分を探し、取り組むようにする。,9
28,28,目には見えないネットワーク,系というのは、目に見えないため、その関係のネットワークを想像力によって思い描くことによってしか捉えることはできない。例えば、生態系において、植物や動物は目に見えるかたちで存在していても、食物連鎖の関係や共存関係などは目で見ることはできないが、それらは確かにひとつの関係性として「ある」。そのような目に見えないネットワークに思いを馳せて、感じるようにする。,10
29,29,意外な影響要素,《目には見えないネットワーク》のなかで、影響を与えているかもしれない意外な要素に目を向けてみる。そうすると、その要素をないがしろにせず、気をかけることができるようになる。,10
30,30,あえて言う,「店がある」「会社がある」「〇〇を売っている」「〇〇をしている」「〇〇という商品・サービスがある」など、当たり前に知っているだろうと思うような内容であっても、あえて伝えてみる。ストレートに伝え直すことで、意外と結果は変わることがある。伝えてみたら、それによってお客さんの《行動の変化》があったかを確認し、他に伝えるべき当たり前のことが漏れていないかも確認していく。,12
31,31,景色にならない存在感,何かを伝えたいときには、それが背景に埋もれないで、ポップ・アップして目に入るように心がける。具体的には届けたい情報が背景と同化しないように留意しながら、色・配置・大きさ・形などを工夫する。,13
32,32,興味を引く言い方,商品やサービスについて書くときには、お客さんの関心をつかむような投げかけをする。例えば、「あの〇〇」「店長おススメの〇〇」などとすることで、興味をもってもらうきっかけとなったり、会話が起こりやすくなったりする。,13
33,33,ビジュアルのアイ・キャッチ,文字や文章で伝えようとすると、興味をもって読み始めてくれたお客さんにしか伝えることができない。特にどうしても伝えたいことなどは、目に飛び込みやすい写真・画像などのアイキャッチ力を利用して届けるようにする。例えば、目を引く写真のキャプションに伝えたいことを入れることで、伝わる確率を高くすることができる。,13
34,34,具体的に伝える,お客さんに取ってもらいたい行動があるときには、「見てください」、「電話ください」、「角を曲がってください」、「手に取ってください」など、してほしいことをわかりやすく具体的に伝えるようにする。そうすることで、お客さんの心が動いたあとに、次の行動へとスムーズにつながりやすくなる。,14
35,35,わかりやすいかチェック,お客さんに取ってほしい行動を具体的に伝えているつもりなのに、なかなかその行動が起きないときには、お客さんの立場に立って、自分の伝えていることがどう見えるかを確認する。《行動のガイド》が見にくかったり、実は見えていなかったりしないか、また意味が伝わりにくくなっていないかを検証し、動きが止まってしまっている理由を突き止めるようにする。,14
36,36,心の充足とお悩み解決,お客さんにどのような価値を提供できるか考えるときは、のアプローチとして、「心の充足」と「悩みの解決」という２つの視点をもってみる。「心の充足」では、その商品・サービスは、お客さんのどのような気持ちを満たすことができるか、「悩みの解決」では、お客さんのどのような困りごとを解決できるのかに着目し、提供し得る価値を考えていく。,15
37,37,生活全体のイメージ,商品やサービスの価値というと、それを使うことのことを考えやすいが、一度視野を広くして、お客さんの生活全体に目を向けてみる。こんな生活をしているのではないか、こんな気もちなのではないかと考えることで、困りごとや、こういう時間が持てたらいいのではないかなどをイメージし、商品・サービスがそれにどう貢献できるかを考えていく。,15
38,38,うちのお客さん像,なじみのお客さんたちはどのような人なのか、どんなことに関心があるのかなどについて捉えるようにする。例えば、日頃の会話などから行動・関心・気持ちなどを知るようにしておくと、投げかけに対する反応なども想像がしやすく、喜んでもらえるポイントを見つけやすくなる。,15
39,39,つくり手の想い,商品・サービスの価値というものは、それを使用している場面やもたらす効果だけでなく、それをつくった人の想いや背後にあるストーリーによっても増強することができる。そのようなバックストーリーについて調べ、それを伝えることで、付加価値をつくっていくことができる。,15
40,40,価値から伝える,《価値の掘り起こし》で見出したことを、商品名より何より先に伝えるようにする。商品名や値段などは、確かに必ず伝えなければいけないものではあるが、お客さんの心を動かす材料にはなりにくい。そこで、まずは価値を伝えて関心をもってもらい、その後に必要なことを伝えるという順番を大切にする。,16
41,41,直感的なわかりやすさ,お客さんが直感的に価値（買うともたらされること）をイメージできるように伝えることを心がける。例えば、《価値の掘り起こし》で見出した内容を、「〇〇のような」という例えを用いて表現することで、想像しやすくしたり、その商品・サービスの効果を感じてもらえるように、使い方を実演してみせたり、五感に訴えるなどして、直感的に「よい！」、「よさそう！」と感じてもらえるようにする。,16
42,42,どこで止まっているのか,最終的に「買う」という行動にまでつなげてもらえるように、お客さんの動きを見たり、考えたりしながら、買うまでの行動を細かく刻み、どこで途切れてしまっているのかを見つけだす。そこで止まっている理由を突き止め、その行動を起こせるようハードルを下げたり、次の行動に移れるような後押しをしたりすることで、買うという行動への流れをよくする。,17
43,43,ためらいの理由,商品を手に取ったまま迷っていそうなお客さんや、関心をもっていそうな馴染みのお客さんに話しかけるなどして、その人がどんなことがわからず買うのをためらっているのか、またその商品についてのどんなことを知りたいのかを聞くようにし、買うことをためらう理由を突き止めるようにする。,17
44,44,溝を埋める情報,《どこで止まっているのか》や《ためらいの理由》が見えてきたら、それを解消するために必要な情報をわかりやすく伝えるようにする。例えば、その商品・サービスを購入するにあたり、そのお客さんにとって適正な数量がわからないという理由がある場合には、「この人数なら、目安の数量としてはこれくらい」などといった情報を付加する。多様なラインナップの中からどれを選んでよいのかわからない、ということであれば、「まず最初に試していただくのはこれがおすすめ」というようなことを伝えるようにする。,17
45,45,気づいてもらえる距離,何かの情報に触れ、それが欲しいと思ってもらえているのに、その商品・サービスがどこに置いてあるのかがわからないためにお客さんの行動が止まってしまうこともある。そんなときは、店頭などでは、目につくお知らせなどからすぐ手の届く距離に商品・サービスを置き、インターネットなどでは、その商品・サービスにたどり着きやすいようにページを構成するようにする。,17
46,46,自分の経験の分析,お客さんの「買う」行動を考えるために、自分がお客さんとして買い物をするときの普段の行動に目を向ける。何かを買う時に、何を見てどう思って選び、最終的に買ったのかに意識的になり、買うにいたった経緯を分析してみる。そうすることで、行動のつながりや、何が決め手になるのかなどが理解しやすくなり、自分が販売するときに活かしていくことができる。,17
47,47,体験全体の質,店であれば、店舗の雰囲気やそこでの会話、場づくりなど、サービスであれば、前後の流れや余韻など、体験の全体によってもたらされる満足感を高めるということを意識する。例えば、お店であれば、買い物中に子どもが遊ぶ場があり、親子で来たお客さんがゆっくりくつろいで買い物できる環境を整えたりする。セミナー等であれば、会場に入ってからの待ち時間や終了後の余韻なども演出したりするとよいだろう。,18
48,48,お客さんのストーリー,お客さんを、自分が接している時間だけで見るのではなく、ここに来るまでの背景や、自分たちを選んでくれた理由などにも目を向け、お客さん全体のストーリーを意識する。そして、自分はその生活の中の一役を担っているのだと捉えて、《ひとまわり大きな価値》をつくっていく。,18
49,49,会話に潜むニーズ,お客さんからの「こういうものがあればいいのに」「こういうことはできないの？」などの何気ない発言や質問を、それは自分たちに向けての隠れた期待であると捉えてみる。そうした商品・サービスが提供できるかを検討してみるのもよいだろう。,18
50,50,使いこなしのアドバイス,その商品やサービスの効果が最大限に発揮されなければ、その買い物の価値が低く感じられてしまうので、どのように使えば、より役立つのか、より力を発揮するのかもきちんと伝えていく。例えば、その商品・サービスを良い状態で利用し続けるコツや、より良さを発揮できる扱い方、プロだからこそ知っている裏技などを出し惜しみなく伝えていく。,18
51,51,ほしいと思う理由,お客さんに合うものを提供しようとするときには、まず、お客さんは何がしたいのか、どういったもの・価値がほしいと思っているのかをきちんと聞くようにする。そのとき、値段で制約をかけて入るのではなく、手に入れたい価値の方から選んでいくようにするとよい。,19
52,52,お客さんを支(ささ)える,自分の持っている知識・技術を使い、お客さんの生活をより良くすることを目標にする。そうすることで、困ったことがあったら聞いてみようと頼られる存在になっていく。お客さんに「支(つか)える」のではなく、プロとしてお客さんを「支(ささ)える」のである。,20
53,53,あなたに合うもの,プロの知識・技術から考えて、「あなたに合うものは、これ」と提案する。そうやって提案するときには、その理由も添えて伝えるようにするとよい。時には、本人がまったく関心をもっていなかったものや、合わないと思っていたものもあるかもしれないが、それはその人の視野を広げることになるかもしれない。,20
54,54,自分の世界を織り交ぜる,自分がお客さんに対して、どのような価値を提供できるかを考えるときには、自分の業種や仕事の常識や枠に囚われず、自分の好きなことや得意なことを取り込み、自分の見ている世界や自分が感じている魅力的な世界観を織り交ぜていく。店・事業の常識的な範囲から大きくはずれていることでも、自分が心から好きなことや得意なことの世界がそこに重なると、新しい価値や新しい世界を拓く可能性があり、予想を超えた大きな反響を呼ぶことがあるので、躊躇せず試してみるとよいだろう。,20
55,55,幸せ増やしのお手伝い,今の商品・サービスや事業形態に囚われず、お客さんの幸せをどう増やしていくかを考え続けていく。そうすると、お客さんの心を動かし続けることができ、自分らしい店・事業づくりにつながっていく。,20
56,56,人々を魅了しているもの,《心豊かな世界》をもたらすことができるようになるためには、世の中で素晴らしいと賞賛されたり、よいと話題になったりしているもの、例えば、映画や音楽、本やイベントに積極的に触れ、人の心がどのようなことで動くのか知るようにするとよい。もともと自分がまったく興味がなかったものでも、多くの人を魅了するようなものがどのようなもので、それがどのように人々を魅了しているのかを学ぶと、自らの幅が広がるとともに、心の感度と感性が磨かれるだろう。,20
57,57,加わりたくなるリスト,お客さんに個人情報を聞くと警戒されてしまうのではないかなどと考えてしまい、集め始めることに躊躇してしまうことがある。そんなときは、お客さんが自ら喜んで連絡先を登録したくなるようなアイデアを考え、自然な流れの中で聞いていけるようにする。,22
58,58,つながりをつくりに行く,すでにお客さんとして来てくれている人だけでなく、店や事業と関わる人を自分から増やしていくことを意識する。地域や関連の他業種などにも視点を広げ、そこに関わる人たちと出会えるようなイベントに積極的に参加するなどして、出会いをつくりつながりを増やしていく。,22
59,59,興味をもってもらえる名刺,はじめて会ったときにお渡しする名刺に、その後、つながっていきやすくするための工夫をする。自分自身や店・会社に興味をもってもらえるようにしておくことで、名刺をきっかけに会話が弾んだり、やりとりが継続したりして、距離を縮めやすくなる。,22
60,60,まずは全員へ,お客さんとつながるための取り組みを始めるとき、誰に、またはどの範囲までアプローチすべきかなどを考えてしまうことがあるが、一度接点があった人であれば、例外なく全員がつながる対象と考えるようにする。,23
