id,pattern_no,pattern_name_ja,b_solution_ja,pattern_id 紐づくパターンのIDを入れてください。
61,61,21日間に3回,初めの接触の後、覚えてもらうためには21日間で3回接触するとよいと。どのような内容でどのように連絡をすれば、良い印象の関係づくりが始められるかを考え、まずは覚えてもらうためのプログラムとして全員に実施する。,23
62,62,思いがけないプレゼント,接点が生まれ、関係をつくることができそうだと感じ始められたら、ちょっとしたプレゼントを贈り、こちら側の気持ちを届けるようにする。プレゼントの内容としては高価なものを避け、一人あたり10円以下というくらい、ほぼコストをかけずに思いを伝えられるものにする。,23
63,63,メイン・リストへの合流,新しく接点のできたお客さんへの《お近づきのアプローチ》が終わったら、その時点（タイミング）で関係が続いている人を今までのお客さんと同じ連絡リストに追加し、メールやニューズレターを送るなど、既存のお客さんと同じコミュニケーションに変えていく。,23
64,64,まずは自己紹介,自己開示は、まずは自己紹介から始める。そのためのメディアは、自分たちの業態に合ったお客さんとの接点を考え、メールやニューズレター、ホームページやSNSに載せたり、チラシや名刺にアレンジを加えたりと、様々な可能性がある。店舗の場合には、A型看板や、店内の自己紹介ボード、名札にちょっとした情報を加えるなど、お客さんとの会話のきっかけになりやすいよう、散りばめておくのもよい。,24
65,65,心が近づくお便り,自己開示として何を書いていいかわからないときには、「最近あったできごと」と「そのとき感じたこと」を通じて、自分が感動したことや楽しかったことを伝えるようにする。この発信の目的がお客さんとの関係を築くためだということを忘れないようにし、お客さんへのお手紙を書いている意識をもつと良い。,24
66,66,目的のないおしゃべり,仕事している「自分」のスタイルを変えていくのは、きっかけやその度合いなどなかなか難しいと感じることもある。そんなときには、まずははっきりした意図を持たない、例えば知り合いに近況を聞くようなさりげない会話をしてみる。そのような会話を続けることで、相手の人となりが見えてきて、自然な会話につながっていく。,25
67,67,心からしてあげたいこと,お客さんに対してこうしてあげたいと感じたことがあれば、あまり深く考えずに自然に行動に移してみる。例えば、お客さんがいつもより少し元気がなく、様子が違うように感じたときには、お茶やお菓子を出して一息ついていくようにすすめるなど、自分の自然な感情や思いを出していくようにする。,25
68,68,言葉がけひとつでも,業界や会社の方針・制約で、お客さんに何かをあげたり、場をもったりすることは難しいかもしれない。そうであっても、言葉がけひとつでも、お客さんの心に通じる絆はつくることができる。,25
69,69,馴染みへのステップアップ,お客さんが自分のことを少し身近に感じてくれるようになったことを感じたら、それに呼応するように、こちらも少しラフに友達口調で話してみるなど、コミュニケーションを変えてみる。例えば、声をかけてくれる回数が増えてきたり、お客さんも自己開示をしてきてくれるようになったりなどが、切り替えのサインと言えるかもしれない。,25
70,70,長いお付き合い,お客さんとの関係を築いていく際には、短期的な視点ではなく、長期的な視点をもち、長い付き合いをつくるよう意識する。例えば、10年経つと、お客さんの家族の生活の状況や環境が変わり、新しいニーズや要望が出てくるかもしれず、そういう長いお付き合いのなかで、自分たちができることは今見えている以上にあるかもしれない。,25
71,71,お客さんを巻き込む,催しごとなどを企画するときには、お客さんにも役割を持ってもらうなどして、どんどん巻き込んでいくようにする。そうすると、与える人、与えられる人という関係性を超えて、ともに取り組む仲間という一体感や達成感を共有することができる。そのような体験は、単なるイベント参加とは違う、《心に残る体験》となる。,26
72,72,うちらしいコンテンツ,世の中には多様な催しものがあるので、どこでもやっているようなことをやっても、《心に残る体験》にはならないかもしれない。そのため、自分たちらしい内容であったり、自分たちの想いが込められるものにすることを大切にする。,26
73,73,ちょっとした特別感,馴染みになってきたお客さんには、他のお客さんとは違うちょっとした特別感を演出するようにするのもよい。例えば、常連のお客さんには、「えこひいき」メニューを用意したり、少し違うサービスをしたりして、特別だという気持ちを伝えるようにする。,26
74,74,「ありがとう」の等価交換,お客さんには「買ってもらう」のだという視点に捉われずではなく、お客さん自身から「提供してくれて（売ってくれて）、ありがとう」と言ってもらえるような関係を目指すようにする。つまり、お客さんにとって価値のある商品やサービスを提供すること、対価として代金をいただくことが互いの「ありがとう」の気持ちとして相互に行き交うようなイメージで商いをしていく。,27
75,75,また来たくなるしかけ,イベントなどで集まった人には、単にその場で終わりではなく、また来たくなるような気持ちになるような工夫をして、商売や事業につなげていくことを忘れないようにする。,27
76,76,まわりからの見え方,うちらしさというのは、自分たち自身ではうまく捉えることができないことが多い。そこで、お客さんや取引先・周りの人などから、自分たちの雰囲気や印象について何かを言われたときには、それは「うちらしさ」なのだと捉えてみて、外からの見え方も取り込みながら、自分たちの「うちらしさ」像をつくっていく。,28
77,77,うちらしいか,「今の状態はうちらしいだろうか」、「新しい取り組みはうちに合っているだろうか」、「これを何と伝えると、うちらしくなるだろうか」、というように、自分たちらしいかを常に考えながら、やるべきことを決めていく。,28
78,78,ミッションの更新,今までこうだと信じて進んできたことに違和感をもつようになったり、今後やっていきたいことが変わったりしたときには、過去の「うちらしさ」に固執するのではなく、新たに見えてきた方向性や、自分たちの持ち味、世界観に合わせて、店・事業のミッションを更新していく。,28
79,79,それをやらない代わりに,明らかにやった方がよいと思われる施策や、多くの人がやっている定番のやり方でも、どうにも自分たちには合わないと感じてと、気が向かないものがあるかもしれない。そのようなときには、自分の感性や性分に合わないことに無理にやるのではなく、それをやらない代わりに自分たちはどうするのかを考えるようにする。同じ目的を達成するための、別のよいアプローチが見つかるかもしれない。,28
80,80,本業の軸,新しいことを仕掛けたり、何かを変えたいと思ったりすると、目新しさに意識を向けすぎ、店や事業のアイデンティティが失われてしまうことがある。そのため、変わっていくときにこそ、自分がプロとして経験と信頼を積んできている領域が店や事業の軸であることを改めて認識し、それを柱としてぶらさないことを大切にする。,29
81,81,ファンと呼び得るお客さん,満足を提供できているかではなく、自分の店・会社やそこにいる自分のことを「ファン」と呼べるくらい「好き」だと思ってもらえているかを基準にして、そうなってもらえるように取り組みを考える。,29
82,82,つい行きたくなる,より自分らしく、自分にしかできない店・事業にしていけるように考える際には、例えば「目的がなくても行きたくなる店や場所」になるためにはどうしたらよいかと発想してみるのも有効である。そうすることで、商品やサービスに頼らず、自分自身や店・場全体の価値を高めていくことに振り切って考えやすくなる。,29
83,83,ファン同士が出会える場,自分はファンと呼び得るお客さんを知っているが、そのファン同士はお互いに知らないので、そういう人たちが集まるような機会をつくるようにする。そうすると、ファン同士がつながり、互いに連絡を取り合ったり、何か面白いことを提案してくれたりすることにつながるかもしれない。,30
84,84,こちら側に来る機会,お客さんと店・事業主という関係を超え、お客さんをこちら側に惹き込んでいき、自分たちのやっていこうとする取り組みを一緒に展開する仲間になってもらうような意識をもつ。例えば、ちょっとしたお手伝いをしてもらったり、お客さんが動かなければ成り立たないようなイベントに巻き込んでみるなどして、こちら側に立ってもらうことを考えていく。,30
85,85,Win-Winになること,自分とファンの間に質の良い関係を築いていこうとするときには、つながることがお互いにとってwin-winとなる、つまりお互いに良いことがあるように意識する。例えば、お客さんの喜びやメリットになることと、自分のやりたいことや目指すこととをうまく併せていき、相乗効果が発揮できるようなことを考えていくとよい。,30
86,86,ここなら行けそう,《場に出てみる》と言われても、なかなかそういう気持ちが起きないこともある。そんなときには、自分にとってのハードルが低く、行けそう、ここなら行ってもいいという場を探してみる。「知り合いがいる方がいい」「誰も知らない方がいい」「大規模な方が楽」「セミナー形式がいい」など、人によって「行けそう」と思う条件は様々なので、幅広く見て、気持ちが向くものをピックアップしてみると良い。,32
87,87,好みの場探し,実践している人たちが集まる場に行ってみたものの、自分には合わなかったと感じときには、他の集まりや勉強会にも出てみるようにする。参加者や内容によって雰囲気も違ってくるものなので、いくつかまわってみて、居心地がいいと思える場を探すようにする。,32
88,88,始めたことを言う,（「価値創造マーケティング」という）新しい取り組み・学びを始めたことを周囲の人や仕事でつながりのある人に話してみる。そうすることで、何かのアドバイスをもらえたり、実践している先輩を紹介してもらえたりするかもしれない。,32
89,89,ガバッといれる,事例やエピソード、またセミナーや書籍の数が多く、どうやって理解を進めたらいいかわからなくなってしまう。そんなときには、いきなりしっかり覚えたり理解したりしようという思いにとらわれず、理解できていないままでよいので、とにかくたくさんの量の情報や知識を自分の中に入れ続けることを大切にする。今は分かっていなくても、頭の片隅に入れることで、後でつながって知識になっていくことが多くある。,33
90,90,目から耳から,つかる時には、思いつくありとあらゆる手段を使い、可能な限り浸かってみることを意識する。例えば、BGMとして耳から入れたり、とにかく人に話してみるなど、見たり読んだりするだけでなく、いろいろな方向から触れるようにする。,33
91,91,つかり期間の決め打ち,何事も学びはじめは不安が出てくるもので、自分には合わなかったのではないかという思いがよぎるものである。そこで、新しいことをはじめたんだから、まずこれくらいは頑張ろうという期間をはじめに決めておき、それまでは浸かることに専念する。,33
92,92,すごい人もただのおじさん,有名な実践者やすごい結果を残している人でも、会う機会があれば、積極的に話しにいくようにする。そうすると、すごいと思っていた人も実は自分と同じ一人の人間であることが感じられ、並外れた実践例や実績も自分と別世界のものではなく、いずれそうなれるのではないかという思いを持てるようになる。,34
93,93,商いの別の顔,今まで触れてきた自分の業界や業種のなかでの常識や理論が自分にとって馴染みがありすぎて当たり前だと思ってしまっていると、新しい考え方や知識を受け入れにくいことがある。そんなときには、これまで学んできた商売やビジネスの感覚を一旦横に置き、価値創造マーケティングのメッセージに耳を傾けてみる。,34
94,94,話すことによる気づき,一人で実践をしていると、実は考えが深まっていなかったり、間違った理解をしていても気づいていなかったりすることもある。そんなときには、先輩たちの集まる場などで、積極的に自分のやったことを話すようにする。,35
95,95,工夫の宝庫,実践者同士で語り合う価値のひとつに、生の実践事例、またそれに関する気づき・発見がたくさん得られるというものがある。違う業種や業態であっても気にせず、実践してみたことやその反応をお互いに報告し、それについて話し合うことで、相手も自分も理解を深めていけるような時間を多く持つようにする。,35
96,96,理論の言葉を使う,実践者同士や先輩と話すときには、できるだけ価値創造マーケティングの解説や理論の中で使われている用語を使って話すようにする。そうすることで、脳が馴染みやすくなり、もしも誤った理解をしていたとしても、修正することができる。,35
97,97,マスターによる解説,ある程度実践できるようになって、自分のなかで何となくつかめてきたり、とても素晴らしい実践ができたのではないかと感じたりしたときには、それを文章としてまとめ、実力のある人や講師をしている人など、解説のできる人に読んでもらうようにする。,36
98,98,正しい理解へのこだわり,理解を深めていこうとする時期にもいろいろな情報に多く触れるべきではあるが、自分の理解を進めるために信じるべき情報は、正しさにこだわって取捨選択するようにする。積極的に《習った用語を使う》ことで、解釈が自分流になってしまっているところはないかを謙虚に確かめ、正しい理解を積み重ねていけるように努力する。,36
99,99,ひとりじゃないということ,毎日の現場では、実践をしているのが自分ひとりだけだったり、自分のしている取り組みが周りの人から共感や理解が得られなかったりして、不安になってしまうことがある。そんなときは、実践している仲間が集まる場に出て行き、仲間や先輩たちの話をたくさん聞くようにする。,37
100,100,先輩の太鼓判,実践を進めてきているが、自分のやっていることが合っているかどうか自信がもてないときは、先輩と会える場所に出ていき、自分のしていることや作ったもの、起こったことなどを話してみて、感想や意見を聞いてみる。そして、先輩が、どの点に「よい」と感じるのかを知り、今の自分の取り組み方の強みだと捉え、そこに自信をもって実践を進めていくようにする。,37
101,101,コミュニティへの恩返し,自分がこれまで仲間や先輩にしてもらってきたことをする側に回り、今度は恩返しをするつもりで、後に続く人たちの相談に乗ったり、サポートをしたりする。そうすることで、過去の取り組みを振り返って客観視したり、詳細に説明しようと試みるなかで、新たな見え方が生まれてくる。,38
102,102,生き証人,はじめたばかりの人から見ると、いろいろな実績を残してきた人は特別な人であり、とても手の届く存在ではないように感じられてしまうかもしれない。そんなときには、話しかけたり質問に答えたりしながら、難しそうに見えることでも、実はコツコツと学び、実践を積み重ねてきた結果であることを感じてもらい、誰でもここまで到達できるという「生き証人」として、みんなを勇気づけていく。,38
103,103,既存のコミュニティとつながる,取り組みを大きくしたり、新しい領域にチャレンジするために仲間を増やしていくときには、すでに活動しているコミュニティとつながるようにすると、速く大きく広げていくことができる。,39
104,104,共感の確認,一緒に取り組む仲間を増やしていくときには、価値創造マーケティングの考え方やこれからやろうとする目的やミッションに共感しているかどうかを確認する。そうすることで、気が合うように思えても、気持ちにばらつきがあったり、目指す方向が違っていたりして、足並みが乱れてしまうのを防ぐことができる。,39
105,105,生き方と商売の融合,《終わりなき道》を楽しみながら歩んでいくためには、自分の生き方や好きなことと、仕事を分けて考えず、商売や事業に自分の感性を思い切り出していきながら、仕事も人生も高めていくようにする。,40
106,106,人としての成長,店・事業の発展、人間としての向上は《終わりなき道》であり、同じ思想をもつエネルギッシュな人たちに触れ続け、学んできたコミュニティ、自分の属する地域などに還元していきながら、人間性を向上させていく活動であると捉える。,40